{
  "schemaVersion": "1.0",
  "projectId": "demo",
  "commitSha": "171b8f0",
  "generatedAt": "2026-08-04T04:00:00.000Z",
  "nodes": [
    {
      "id": "module:apps/web",
      "name": "web",
      "kind": "module",
      "path": "test/apps/web",
      "domain": "apps",
      "summary": "React 前端，消费 API 渲染预订与目录页面",
      "evidence": [
        {
          "file": "test/apps/web/src/api/client.ts",
          "startLine": 8,
          "endLine": 34,
          "symbol": "apiClient"
        }
      ],
      "inferred": false
    },
    {
      "id": "module:apps/api",
      "name": "api",
      "kind": "module",
      "path": "test/apps/api",
      "domain": "apps",
      "summary": "HTTP 入口，装配路由、中间件与依赖上下文",
      "evidence": [
        {
          "file": "test/apps/api/src/app.ts",
          "startLine": 12,
          "endLine": 48,
          "symbol": "createApp"
        }
      ],
      "inferred": false
    },
    {
      "id": "module:apps/worker",
      "name": "worker",
      "kind": "module",
      "path": "test/apps/worker",
      "domain": "apps",
      "summary": "后台消费者，处理事件总线异步任务",
      "evidence": [
        {
          "file": "test/apps/worker/src/worker.ts",
          "startLine": 10,
          "endLine": 42,
          "symbol": "startWorker"
        }
      ],
      "inferred": false
    },
    {
      "id": "module:modules/booking",
      "name": "booking",
      "kind": "module",
      "path": "test/modules/booking",
      "domain": "modules",
      "summary": "预订编排：库存校验、下单、与支付协同",
      "evidence": [
        {
          "file": "test/modules/booking/src/create-booking.ts",
          "startLine": 18,
          "endLine": 56,
          "symbol": "createBooking"
        }
      ],
      "inferred": false
    },
    {
      "id": "submodule:modules/booking/src/booking-policy.ts",
      "name": "booking-policy",
      "kind": "submodule",
      "path": "test/modules/booking/src/booking-policy.ts",
      "domain": "modules",
      "parentId": "module:modules/booking",
      "summary": "预订规则校验，集中处理库存与状态约束",
      "evidence": [
        {
          "file": "test/modules/booking/src/booking-policy.ts",
          "startLine": 1
        }
      ],
      "inferred": false
    },
    {
      "id": "submodule:modules/booking/src/booking-repository.ts",
      "name": "booking-repository",
      "kind": "submodule",
      "path": "test/modules/booking/src/booking-repository.ts",
      "domain": "modules",
      "parentId": "module:modules/booking",
      "summary": "预订数据访问接口，隔离业务逻辑与持久化实现",
      "evidence": [
        {
          "file": "test/modules/booking/src/booking-repository.ts",
          "startLine": 1
        }
      ],
      "inferred": false
    },
    {
      "id": "submodule:modules/booking/src/create-booking.ts",
      "name": "create-booking",
      "kind": "submodule",
      "path": "test/modules/booking/src/create-booking.ts",
      "domain": "modules",
      "parentId": "module:modules/booking",
      "summary": "下单用例编排，串联校验、保存、支付与事件发布",
      "evidence": [
        {
          "file": "test/modules/booking/src/create-booking.ts",
          "startLine": 18,
          "symbol": "createBooking"
        }
      ],
      "inferred": false
    },
    {
      "id": "module:modules/catalog",
      "name": "catalog",
      "kind": "module",
      "path": "test/modules/catalog",
      "domain": "modules",
      "summary": "活动与场次目录，读多写少带缓存",
      "evidence": [
        {
          "file": "test/modules/catalog/src/list-events.ts",
          "startLine": 9,
          "endLine": 38,
          "symbol": "listEvents"
        }
      ],
      "inferred": false
    },
    {
      "id": "module:modules/identity",
      "name": "identity",
      "kind": "module",
      "path": "test/modules/identity",
      "domain": "modules",
      "summary": "用户身份、会话与权限判定",
      "evidence": [
        {
          "file": "test/modules/identity/src/authorization-service.ts",
          "startLine": 7,
          "endLine": 40,
          "symbol": "AuthorizationService"
        }
      ],
      "inferred": false
    },
    {
      "id": "module:modules/payment",
      "name": "payment",
      "kind": "module",
      "path": "test/modules/payment",
      "domain": "modules",
      "summary": "支付网关适配与交易状态机",
      "evidence": [
        {
          "file": "test/modules/payment/src/start-payment.ts",
          "startLine": 14,
          "endLine": 52,
          "symbol": "startPayment"
        }
      ],
      "inferred": false
    },
    {
      "id": "module:modules/notification",
      "name": "notification",
      "kind": "module",
      "path": "test/modules/notification",
      "domain": "modules",
      "summary": "事件驱动通知投递，订阅领域事件",
      "evidence": [
        {
          "file": "test/modules/notification/src/send-booking-confirmation.ts",
          "startLine": 11,
          "endLine": 44,
          "symbol": "sendBookingConfirmation"
        }
      ],
      "inferred": false
    },
    {
      "id": "module:modules/reporting",
      "name": "reporting",
      "kind": "module",
      "path": "test/modules/reporting",
      "domain": "modules",
      "summary": "聚合报表查询，直读数据库并缓存",
      "evidence": [
        {
          "file": "test/modules/reporting/src/get-dashboard-stats.ts",
          "startLine": 10,
          "endLine": 46,
          "symbol": "getDashboardStats"
        }
      ],
      "inferred": false
    },
    {
      "id": "module:packages/contracts",
      "name": "contracts",
      "kind": "module",
      "path": "test/packages/contracts",
      "domain": "packages",
      "summary": "跨模块共享类型契约与事件定义",
      "evidence": [
        {
          "file": "test/packages/contracts/src/index.ts",
          "startLine": 1,
          "endLine": 24
        }
      ],
      "inferred": false
    },
    {
      "id": "module:packages/database",
      "name": "database",
      "kind": "module",
      "path": "test/packages/database",
      "domain": "packages",
      "summary": "连接池、迁移与仓储基类",
      "evidence": [
        {
          "file": "test/packages/database/src/pool.ts",
          "startLine": 6,
          "endLine": 40,
          "symbol": "createPool"
        }
      ],
      "inferred": false
    },
    {
      "id": "module:packages/event-bus",
      "name": "event-bus",
      "kind": "module",
      "path": "test/packages/event-bus",
      "domain": "packages",
      "summary": "发布订阅抽象，解耦模块通信",
      "evidence": [
        {
          "file": "test/packages/event-bus/src/index.ts",
          "startLine": 1,
          "endLine": 20
        }
      ],
      "inferred": false
    },
    {
      "id": "module:packages/cache",
      "name": "cache",
      "kind": "module",
      "path": "test/packages/cache",
      "domain": "packages",
      "summary": "读缓存封装，带失效策略",
      "evidence": [
        {
          "file": "test/packages/cache/src/index.ts",
          "startLine": 1,
          "endLine": 18
        }
      ],
      "inferred": false
    },
    {
      "id": "module:packages/shared",
      "name": "shared",
      "kind": "module",
      "path": "test/packages/shared",
      "domain": "packages",
      "summary": "基础工具、错误类型与日志",
      "evidence": [
        {
          "file": "test/packages/shared/src/index.ts",
          "startLine": 1,
          "endLine": 16
        }
      ],
      "inferred": false
    },
    {
      "id": "infra:postgres",
      "name": "PostgreSQL",
      "kind": "infra.db",
      "path": null,
      "domain": "infra",
      "summary": "主数据库（PostgreSQL）",
      "evidence": [],
      "inferred": false
    },
    {
      "id": "infra:redis",
      "name": "Redis",
      "kind": "infra.redis",
      "path": null,
      "domain": "infra",
      "summary": "缓存 / 会话存储",
      "evidence": [],
      "inferred": false
    },
    {
      "id": "infra:mq",
      "name": "Message Queue",
      "kind": "infra.mq",
      "path": null,
      "domain": "infra",
      "summary": "消息队列（事件总线后端）",
      "evidence": [],
      "inferred": false
    }
  ],
  "edges": [
    {
      "id": "e:module:apps/web->module:apps/api:call",
      "source": "module:apps/web",
      "target": "module:apps/api",
      "type": "call",
      "inferred": false,
      "evidence": [
        {
          "file": "test/apps/web/src/api/client.ts",
          "startLine": 12,
          "symbol": "apiClient"
        }
      ]
    },
    {
      "id": "e:module:apps/api->module:modules/booking:call",
      "source": "module:apps/api",
      "target": "module:modules/booking",
      "type": "call",
      "inferred": false,
      "evidence": [
        {
          "file": "test/apps/api/src/routes/bookings.ts",
          "startLine": 14,
          "symbol": "registerBookingRoutes"
        }
      ]
    },
    {
      "id": "e:module:modules/booking->submodule:modules/booking/src/booking-policy.ts:contains",
      "source": "module:modules/booking",
      "target": "submodule:modules/booking/src/booking-policy.ts",
      "type": "contains",
      "inferred": false,
      "evidence": [
        {
          "file": "test/modules/booking/src/booking-policy.ts",
          "startLine": 1
        }
      ]
    },
    {
      "id": "e:module:modules/booking->submodule:modules/booking/src/booking-repository.ts:contains",
      "source": "module:modules/booking",
      "target": "submodule:modules/booking/src/booking-repository.ts",
      "type": "contains",
      "inferred": false,
      "evidence": [
        {
          "file": "test/modules/booking/src/booking-repository.ts",
          "startLine": 1
        }
      ]
    },
    {
      "id": "e:module:modules/booking->submodule:modules/booking/src/create-booking.ts:contains",
      "source": "module:modules/booking",
      "target": "submodule:modules/booking/src/create-booking.ts",
      "type": "contains",
      "inferred": false,
      "evidence": [
        {
          "file": "test/modules/booking/src/create-booking.ts",
          "startLine": 18,
          "symbol": "createBooking"